{
  "line": 1,
  "column": 1,
  "kind": "Program",
  "elems": [
  {
    "line": 1,
    "column": 1,
    "kind": "StructDecl",
    "elems": [
    {
      "line": 1,
      "column": 8,
      "kind": "Ident",
      "elems": []
    },
    {
      "line": 2,
      "column": 3,
      "kind": "Declare",
      "mut": "val",
      "type": "Int8",
      "elems": [
      {
        "line": 2,
        "column": 3,
        "kind": "Ident",
        "elems": []
      }
      ]
    },
    {
      "line": 3,
      "column": 3,
      "kind": "Declare",
      "mut": "val",
      "type": "Int16",
      "elems": [
      {
        "line": 3,
        "column": 3,
        "kind": "Ident",
        "elems": []
      }
      ]
    },
    {
      "line": 4,
      "column": 3,
      "kind": "Declare",
      "mut": "val",
      "type": "Int32",
      "elems": [
      {
        "line": 4,
        "column": 3,
        "kind": "Ident",
        "elems": []
      }
      ]
    },
    {
      "line": 5,
      "column": 3,
      "kind": "Declare",
      "mut": "val",
      "type": "Int64",
      "elems": [
      {
        "line": 5,
        "column": 3,
        "kind": "Ident",
        "elems": []
      }
      ]
    },
    {
      "line": 6,
      "column": 3,
      "kind": "Declare",
      "mut": "val",
      "type": "Bool",
      "elems": [
      {
        "line": 6,
        "column": 3,
        "kind": "Ident",
        "elems": []
      }
      ]
    },
    {
      "line": 7,
      "column": 3,
      "kind": "Declare",
      "mut": "val",
      "type": "String",
      "elems": [
      {
        "line": 7,
        "column": 3,
        "kind": "Ident",
        "elems": []
      }
      ]
    }
    ]
  },
  {
    "line": 10,
    "column": 1,
    "kind": "FuncDecl",
    "returnType": "Int64",
    "elems": [
    {
      "line": 10,
      "column": 5,
      "kind": "Ident",
      "elems": []
    },
    {
      "line": 10,
      "column": 19,
      "kind": "Block",
      "elems": [
      {
        "line": 11,
        "column": 5,
        "kind": "Declare",
        "mut": "var",
        "type": "Mixed",
        "elems": [
        {
          "line": 11,
          "column": 9,
          "kind": "Ident",
          "elems": []
        }
        ]
      },
      {
        "line": 12,
        "column": 9,
        "kind": "Assign",
        "elems": [
        {
          "line": 12,
          "column": 6,
          "kind": "FieldAccess",
          "elems": [
          {
            "line": 12,
            "column": 5,
            "kind": "Ident",
            "elems": []
          },
          {
            "line": 12,
            "column": 7,
            "kind": "Ident",
            "elems": []
          }
          ]
        },
        {
          "line": 12,
          "column": 11,
          "kind": "IntLiteral",
          "elems": []
        }
        ]
      },
      {
        "line": 13,
        "column": 9,
        "kind": "Assign",
        "elems": [
        {
          "line": 13,
          "column": 6,
          "kind": "FieldAccess",
          "elems": [
          {
            "line": 13,
            "column": 5,
            "kind": "Ident",
            "elems": []
          },
          {
            "line": 13,
            "column": 7,
            "kind": "Ident",
            "elems": []
          }
          ]
        },
        {
          "line": 13,
          "column": 11,
          "kind": "IntLiteral",
          "elems": []
        }
        ]
      },
      {
        "line": 14,
        "column": 9,
        "kind": "Assign",
        "elems": [
        {
          "line": 14,
          "column": 6,
          "kind": "FieldAccess",
          "elems": [
          {
            "line": 14,
            "column": 5,
            "kind": "Ident",
            "elems": []
          },
          {
            "line": 14,
            "column": 7,
            "kind": "Ident",
            "elems": []
          }
          ]
        },
        {
          "line": 14,
          "column": 11,
          "kind": "IntLiteral",
          "elems": []
        }
        ]
      },
      {
        "line": 15,
        "column": 9,
        "kind": "Assign",
        "elems": [
        {
          "line": 15,
          "column": 6,
          "kind": "FieldAccess",
          "elems": [
          {
            "line": 15,
            "column": 5,
            "kind": "Ident",
            "elems": []
          },
          {
            "line": 15,
            "column": 7,
            "kind": "Ident",
            "elems": []
          }
          ]
        },
        {
          "line": 15,
          "column": 11,
          "kind": "IntLiteral",
          "elems": []
        }
        ]
      },
      {
        "line": 16,
        "column": 9,
        "kind": "Assign",
        "elems": [
        {
          "line": 16,
          "column": 6,
          "kind": "FieldAccess",
          "elems": [
          {
            "line": 16,
            "column": 5,
            "kind": "Ident",
            "elems": []
          },
          {
            "line": 16,
            "column": 7,
            "kind": "Ident",
            "elems": []
          }
          ]
        },
        {
          "line": 16,
          "column": 11,
          "kind": "BoolLiteral",
          "elems": []
        }
        ]
      },
      {
        "line": 17,
        "column": 9,
        "kind": "Assign",
        "elems": [
        {
          "line": 17,
          "column": 6,
          "kind": "FieldAccess",
          "elems": [
          {
            "line": 17,
            "column": 5,
            "kind": "Ident",
            "elems": []
          },
          {
            "line": 17,
            "column": 7,
            "kind": "Ident",
            "elems": []
          }
          ]
        },
        {
          "line": 17,
          "column": 11,
          "kind": "StringLiteral",
          "elems": []
        }
        ]
      },
      {
        "line": 18,
        "column": 5,
        "kind": "Declare",
        "mut": "var",
        "type": "Int64",
        "elems": [
        {
          "line": 18,
          "column": 9,
          "kind": "Ident",
          "elems": []
        }
        ]
      },
      {
        "line": 19,
        "column": 12,
        "kind": "Assign",
        "elems": [
        {
          "line": 19,
          "column": 5,
          "kind": "Ident",
          "elems": []
        },
        {
          "line": 19,
          "column": 69,
          "kind": "BinOp",
          "elems": [
          {
            "line": 19,
            "column": 50,
            "kind": "BinOp",
            "elems": [
            {
              "line": 19,
              "column": 31,
              "kind": "BinOp",
              "elems": [
              {
                "line": 19,
                "column": 14,
                "kind": "Cast",
                "type": "Int64",
                "elems": [
                {
                  "line": 19,
                  "column": 27,
                  "kind": "FieldAccess",
                  "elems": [
                  {
                    "line": 19,
                    "column": 26,
                    "kind": "Ident",
                    "elems": []
                  },
                  {
                    "line": 19,
                    "column": 28,
                    "kind": "Ident",
                    "elems": []
                  }
                  ]
                }
                ]
              },
              {
                "line": 19,
                "column": 33,
                "kind": "Cast",
                "type": "Int64",
                "elems": [
                {
                  "line": 19,
                  "column": 46,
                  "kind": "FieldAccess",
                  "elems": [
                  {
                    "line": 19,
                    "column": 45,
                    "kind": "Ident",
                    "elems": []
                  },
                  {
                    "line": 19,
                    "column": 47,
                    "kind": "Ident",
                    "elems": []
                  }
                  ]
                }
                ]
              }
              ]
            },
            {
              "line": 19,
              "column": 52,
              "kind": "Cast",
              "type": "Int64",
              "elems": [
              {
                "line": 19,
                "column": 65,
                "kind": "FieldAccess",
                "elems": [
                {
                  "line": 19,
                  "column": 64,
                  "kind": "Ident",
                  "elems": []
                },
                {
                  "line": 19,
                  "column": 66,
                  "kind": "Ident",
                  "elems": []
                }
                ]
              }
              ]
            }
            ]
          },
          {
            "line": 19,
            "column": 72,
            "kind": "FieldAccess",
            "elems": [
            {
              "line": 19,
              "column": 71,
              "kind": "Ident",
              "elems": []
            },
            {
              "line": 19,
              "column": 73,
              "kind": "Ident",
              "elems": []
            }
            ]
          }
          ]
        }
        ]
      },
      {
        "line": 20,
        "column": 5,
        "kind": "Return",
        "elems": [
        {
          "line": 20,
          "column": 12,
          "kind": "Ident",
          "elems": []
        }
        ]
      }
      ]
    }
    ]
  }
  ]
}
