{
  "line": 1,
  "column": 1,
  "kind": "Program",
  "elems": [
  {
    "line": 1,
    "column": 1,
    "kind": "FuncDecl",
    "returnType": "Int64",
    "elems": [
    {
      "line": 1,
      "column": 5,
      "kind": "Ident",
      "elems": []
    },
    {
      "line": 1,
      "column": 19,
      "kind": "Block",
      "elems": [
      {
        "line": 2,
        "column": 5,
        "kind": "Declare",
        "mut": "var",
        "type": "Array[2](Array[2](Int64))",
        "elems": [
        {
          "line": 2,
          "column": 9,
          "kind": "Ident",
          "elems": []
        }
        ]
      },
      {
        "line": 3,
        "column": 18,
        "kind": "Assign",
        "elems": [
        {
          "line": 3,
          "column": 14,
          "kind": "Subscript",
          "elems": [
          {
            "line": 3,
            "column": 11,
            "kind": "Subscript",
            "elems": [
            {
              "line": 3,
              "column": 5,
              "kind": "Ident",
              "elems": []
            },
            {
              "line": 3,
              "column": 12,
              "kind": "IntLiteral",
              "elems": []
            }
            ]
          },
          {
            "line": 3,
            "column": 15,
            "kind": "IntLiteral",
            "elems": []
          }
          ]
        },
        {
          "line": 3,
          "column": 20,
          "kind": "IntLiteral",
          "elems": []
        }
        ]
      },
      {
        "line": 4,
        "column": 18,
        "kind": "Assign",
        "elems": [
        {
          "line": 4,
          "column": 14,
          "kind": "Subscript",
          "elems": [
          {
            "line": 4,
            "column": 11,
            "kind": "Subscript",
            "elems": [
            {
              "line": 4,
              "column": 5,
              "kind": "Ident",
              "elems": []
            },
            {
              "line": 4,
              "column": 12,
              "kind": "IntLiteral",
              "elems": []
            }
            ]
          },
          {
            "line": 4,
            "column": 15,
            "kind": "IntLiteral",
            "elems": []
          }
          ]
        },
        {
          "line": 4,
          "column": 20,
          "kind": "IntLiteral",
          "elems": []
        }
        ]
      },
      {
        "line": 5,
        "column": 18,
        "kind": "Assign",
        "elems": [
        {
          "line": 5,
          "column": 14,
          "kind": "Subscript",
          "elems": [
          {
            "line": 5,
            "column": 11,
            "kind": "Subscript",
            "elems": [
            {
              "line": 5,
              "column": 5,
              "kind": "Ident",
              "elems": []
            },
            {
              "line": 5,
              "column": 12,
              "kind": "IntLiteral",
              "elems": []
            }
            ]
          },
          {
            "line": 5,
            "column": 15,
            "kind": "IntLiteral",
            "elems": []
          }
          ]
        },
        {
          "line": 5,
          "column": 20,
          "kind": "IntLiteral",
          "elems": []
        }
        ]
      },
      {
        "line": 6,
        "column": 18,
        "kind": "Assign",
        "elems": [
        {
          "line": 6,
          "column": 14,
          "kind": "Subscript",
          "elems": [
          {
            "line": 6,
            "column": 11,
            "kind": "Subscript",
            "elems": [
            {
              "line": 6,
              "column": 5,
              "kind": "Ident",
              "elems": []
            },
            {
              "line": 6,
              "column": 12,
              "kind": "IntLiteral",
              "elems": []
            }
            ]
          },
          {
            "line": 6,
            "column": 15,
            "kind": "IntLiteral",
            "elems": []
          }
          ]
        },
        {
          "line": 6,
          "column": 20,
          "kind": "IntLiteral",
          "elems": []
        }
        ]
      },
      {
        "line": 7,
        "column": 18,
        "kind": "Assign",
        "elems": [
        {
          "line": 7,
          "column": 14,
          "kind": "Subscript",
          "elems": [
          {
            "line": 7,
            "column": 11,
            "kind": "Subscript",
            "elems": [
            {
              "line": 7,
              "column": 5,
              "kind": "Ident",
              "elems": []
            },
            {
              "line": 7,
              "column": 12,
              "kind": "IntLiteral",
              "elems": []
            }
            ]
          },
          {
            "line": 7,
            "column": 15,
            "kind": "IntLiteral",
            "elems": []
          }
          ]
        },
        {
          "line": 7,
          "column": 20,
          "kind": "IntLiteral",
          "elems": []
        }
        ]
      },
      {
        "line": 8,
        "column": 18,
        "kind": "Assign",
        "elems": [
        {
          "line": 8,
          "column": 14,
          "kind": "Subscript",
          "elems": [
          {
            "line": 8,
            "column": 11,
            "kind": "Subscript",
            "elems": [
            {
              "line": 8,
              "column": 5,
              "kind": "Ident",
              "elems": []
            },
            {
              "line": 8,
              "column": 12,
              "kind": "IntLiteral",
              "elems": []
            }
            ]
          },
          {
            "line": 8,
            "column": 15,
            "kind": "IntLiteral",
            "elems": []
          }
          ]
        },
        {
          "line": 8,
          "column": 20,
          "kind": "IntLiteral",
          "elems": []
        }
        ]
      },
      {
        "line": 9,
        "column": 5,
        "kind": "Declare",
        "mut": "val",
        "type": "Int64",
        "elems": [
        {
          "line": 9,
          "column": 9,
          "kind": "Ident",
          "elems": []
        },
        {
          "line": 9,
          "column": 50,
          "kind": "BinOp",
          "elems": [
          {
            "line": 9,
            "column": 35,
            "kind": "BinOp",
            "elems": [
            {
              "line": 9,
              "column": 31,
              "kind": "Subscript",
              "elems": [
              {
                "line": 9,
                "column": 28,
                "kind": "Subscript",
                "elems": [
                {
                  "line": 9,
                  "column": 22,
                  "kind": "Ident",
                  "elems": []
                },
                {
                  "line": 9,
                  "column": 29,
                  "kind": "IntLiteral",
                  "elems": []
                }
                ]
              },
              {
                "line": 9,
                "column": 32,
                "kind": "IntLiteral",
                "elems": []
              }
              ]
            },
            {
              "line": 9,
              "column": 46,
              "kind": "Subscript",
              "elems": [
              {
                "line": 9,
                "column": 43,
                "kind": "Subscript",
                "elems": [
                {
                  "line": 9,
                  "column": 37,
                  "kind": "Ident",
                  "elems": []
                },
                {
                  "line": 9,
                  "column": 44,
                  "kind": "IntLiteral",
                  "elems": []
                }
                ]
              },
              {
                "line": 9,
                "column": 47,
                "kind": "IntLiteral",
                "elems": []
              }
              ]
            }
            ]
          },
          {
            "line": 9,
            "column": 61,
            "kind": "Subscript",
            "elems": [
            {
              "line": 9,
              "column": 58,
              "kind": "Subscript",
              "elems": [
              {
                "line": 9,
                "column": 52,
                "kind": "Ident",
                "elems": []
              },
              {
                "line": 9,
                "column": 59,
                "kind": "IntLiteral",
                "elems": []
              }
              ]
            },
            {
              "line": 9,
              "column": 62,
              "kind": "IntLiteral",
              "elems": []
            }
            ]
          }
          ]
        }
        ]
      },
      {
        "line": 10,
        "column": 5,
        "kind": "Return",
        "elems": [
        {
          "line": 10,
          "column": 12,
          "kind": "Ident",
          "elems": []
        }
        ]
      }
      ]
    }
    ]
  }
  ]
}
