{
  "line": 1,
  "column": 1,
  "kind": "Program",
  "elems": [
  {
    "line": 1,
    "column": 1,
    "kind": "FuncDecl",
    "returnType": "Int64",
    "elems": [
    {
      "line": 1,
      "column": 5,
      "kind": "Ident",
      "elems": []
    },
    {
      "line": 1,
      "column": 10,
      "kind": "Param",
      "type": "Int64",
      "elems": [
      {
        "line": 1,
        "column": 10,
        "kind": "Ident",
        "elems": []
      }
      ]
    },
    {
      "line": 1,
      "column": 20,
      "kind": "Param",
      "type": "Int64",
      "elems": [
      {
        "line": 1,
        "column": 20,
        "kind": "Ident",
        "elems": []
      }
      ]
    },
    {
      "line": 1,
      "column": 30,
      "kind": "Param",
      "type": "Int64",
      "elems": [
      {
        "line": 1,
        "column": 30,
        "kind": "Ident",
        "elems": []
      }
      ]
    },
    {
      "line": 1,
      "column": 47,
      "kind": "Block",
      "elems": [
      {
        "line": 2,
        "column": 5,
        "kind": "Return",
        "elems": [
        {
          "line": 2,
          "column": 18,
          "kind": "BinOp",
          "elems": [
          {
            "line": 2,
            "column": 14,
            "kind": "BinOp",
            "elems": [
            {
              "line": 2,
              "column": 12,
              "kind": "Ident",
              "elems": []
            },
            {
              "line": 2,
              "column": 16,
              "kind": "Ident",
              "elems": []
            }
            ]
          },
          {
            "line": 2,
            "column": 20,
            "kind": "Ident",
            "elems": []
          }
          ]
        }
        ]
      }
      ]
    }
    ]
  },
  {
    "line": 5,
    "column": 1,
    "kind": "FuncDecl",
    "returnType": "Int64",
    "elems": [
    {
      "line": 5,
      "column": 5,
      "kind": "Ident",
      "elems": []
    },
    {
      "line": 5,
      "column": 19,
      "kind": "Block",
      "elems": [
      {
        "line": 6,
        "column": 5,
        "kind": "Return",
        "elems": [
        {
          "line": 6,
          "column": 16,
          "kind": "Call",
          "elems": [
          {
            "line": 6,
            "column": 12,
            "kind": "Ident",
            "elems": []
          },
          {
            "line": 6,
            "column": 17,
            "kind": "IntLiteral",
            "elems": []
          },
          {
            "line": 6,
            "column": 20,
            "kind": "IntLiteral",
            "elems": []
          }
          ]
        }
        ]
      }
      ]
    }
    ]
  }
  ]
}
