{
  "line": 1,
  "column": 1,
  "kind": "Program",
  "elems": [
  {
    "line": 1,
    "column": 1,
    "kind": "Declare",
    "mut": "var",
    "elems": [
    {
      "line": 1,
      "column": 5,
      "kind": "Ident",
      "elems": []
    },
    {
      "line": 1,
      "column": 9,
      "kind": "IntLiteral",
      "elems": []
    }
    ]
  },
  {
    "line": 2,
    "column": 1,
    "kind": "While",
    "elems": [
    {
      "line": 2,
      "column": 10,
      "kind": "BinOp",
      "elems": [
      {
        "line": 2,
        "column": 8,
        "kind": "Ident",
        "elems": []
      },
      {
        "line": 2,
        "column": 12,
        "kind": "IntLiteral",
        "elems": []
      }
      ]
    },
    {
      "line": 2,
      "column": 16,
      "kind": "Block",
      "elems": [
      {
        "line": 3,
        "column": 5,
        "kind": "If",
        "elems": [
        {
          "line": 3,
          "column": 11,
          "kind": "BinOp",
          "elems": [
          {
            "line": 3,
            "column": 9,
            "kind": "Ident",
            "elems": []
          },
          {
            "line": 3,
            "column": 14,
            "kind": "IntLiteral",
            "elems": []
          }
          ]
        },
        {
          "line": 3,
          "column": 17,
          "kind": "Block",
          "elems": [
          {
            "line": 4,
            "column": 9,
            "kind": "Break",
            "elems": []
          }
          ]
        }
        ]
      },
      {
        "line": 6,
        "column": 7,
        "kind": "Assign",
        "elems": [
        {
          "line": 6,
          "column": 5,
          "kind": "Ident",
          "elems": []
        },
        {
          "line": 6,
          "column": 11,
          "kind": "BinOp",
          "elems": [
          {
            "line": 6,
            "column": 9,
            "kind": "Ident",
            "elems": []
          },
          {
            "line": 6,
            "column": 13,
            "kind": "IntLiteral",
            "elems": []
          }
          ]
        }
        ]
      }
      ]
    }
    ]
  },
  {
    "line": 8,
    "column": 1,
    "kind": "Return",
    "elems": [
    {
      "line": 8,
      "column": 8,
      "kind": "Ident",
      "elems": []
    }
    ]
  }
  ]
}
