{
  "line": 1,
  "column": 1,
  "kind": "Program",
  "elems": [
  {
    "line": 1,
    "column": 1,
    "kind": "Continue",
    "elems": []
  },
  {
    "line": 2,
    "column": 1,
    "kind": "Return",
    "elems": [
    {
      "line": 2,
      "column": 8,
      "kind": "IntLiteral",
      "elems": []
    }
    ]
  }
  ]
}
