{
  "line": 1,
  "column": 1,
  "kind": "Program",
  "elems": [
  {
    "line": 1,
    "column": 1,
    "kind": "ExternDecl",
    "elems": [
    {
      "line": 1,
      "column": 12,
      "kind": "Ident",
      "elems": []
    },
    {
      "line": 1,
      "column": 16,
      "kind": "Ident",
      "elems": []
    },
    {
      "line": 1,
      "column": 19,
      "kind": "Ident",
      "elems": []
    },
    {
      "line": 1,
      "column": 22,
      "kind": "Ident",
      "elems": []
    }
    ]
  },
  {
    "line": 3,
    "column": 1,
    "kind": "FuncDecl",
    "elems": [
    {
      "line": 3,
      "column": 5,
      "kind": "Ident",
      "elems": []
    },
    {
      "line": 3,
      "column": 12,
      "kind": "Block",
      "elems": [
      {
        "line": 4,
        "column": 5,
        "kind": "Return",
        "elems": [
        {
          "line": 4,
          "column": 12,
          "kind": "IntLiteral",
          "elems": []
        }
        ]
      }
      ]
    }
    ]
  }
  ]
}
