{
  "line": 1,
  "column": 1,
  "kind": "Program",
  "elems": [
  {
    "line": 1,
    "column": 1,
    "kind": "FuncDecl",
    "returnType": "Void",
    "elems": [
    {
      "line": 1,
      "column": 5,
      "kind": "Ident",
      "elems": []
    },
    {
      "line": 1,
      "column": 17,
      "kind": "Block",
      "elems": [
      ]
    }
    ]
  },
  {
    "line": 4,
    "column": 1,
    "kind": "FuncDecl",
    "returnType": "Int64",
    "elems": [
    {
      "line": 4,
      "column": 5,
      "kind": "Ident",
      "elems": []
    },
    {
      "line": 4,
      "column": 19,
      "kind": "Block",
      "elems": [
      {
        "line": 5,
        "column": 8,
        "kind": "Call",
        "elems": [
        {
          "line": 5,
          "column": 5,
          "kind": "Ident",
          "elems": []
        }
        ]
      },
      {
        "line": 6,
        "column": 5,
        "kind": "Return",
        "elems": [
        {
          "line": 6,
          "column": 12,
          "kind": "IntLiteral",
          "elems": []
        }
        ]
      }
      ]
    }
    ]
  }
  ]
}
