{
  "line": 1,
  "column": 1,
  "kind": "Program",
  "elems": [
  {
    "line": 1,
    "column": 1,
    "kind": "Declare",
    "mut": "var",
    "elems": [
    {
      "line": 1,
      "column": 5,
      "kind": "Ident",
      "elems": []
    },
    {
      "line": 1,
      "column": 9,
      "kind": "Unary",
      "elems": [
      {
        "line": 1,
        "column": 10,
        "kind": "BoolLiteral",
        "elems": []
      }
      ]
    }
    ]
  },
  {
    "line": 2,
    "column": 1,
    "kind": "Return",
    "elems": [
    {
      "line": 2,
      "column": 8,
      "kind": "Ident",
      "elems": []
    }
    ]
  }
  ]
}
