{
  "line": 1,
  "column": 1,
  "kind": "Program",
  "elems": [
  {
    "line": 1,
    "column": 1,
    "kind": "FuncDecl",
    "elems": [
    {
      "line": 1,
      "column": 5,
      "kind": "Ident",
      "elems": []
    },
    {
      "line": 1,
      "column": 9,
      "kind": "Ident",
      "elems": []
    },
    {
      "line": 1,
      "column": 12,
      "kind": "Ident",
      "elems": []
    },
    {
      "line": 1,
      "column": 15,
      "kind": "Block",
      "elems": [
      {
        "line": 2,
        "column": 5,
        "kind": "Declare",
        "mut": "var",
        "elems": [
        {
          "line": 2,
          "column": 9,
          "kind": "Ident",
          "elems": []
        },
        {
          "line": 2,
          "column": 20,
          "kind": "BinOp",
          "elems": [
          {
            "line": 2,
            "column": 18,
            "kind": "Ident",
            "elems": []
          },
          {
            "line": 2,
            "column": 22,
            "kind": "Ident",
            "elems": []
          }
          ]
        }
        ]
      },
      {
        "line": 3,
        "column": 5,
        "kind": "Return",
        "elems": [
        {
          "line": 3,
          "column": 12,
          "kind": "Ident",
          "elems": []
        }
        ]
      }
      ]
    }
    ]
  },
  {
    "line": 6,
    "column": 1,
    "kind": "FuncDecl",
    "elems": [
    {
      "line": 6,
      "column": 5,
      "kind": "Ident",
      "elems": []
    },
    {
      "line": 6,
      "column": 12,
      "kind": "Block",
      "elems": [
      {
        "line": 7,
        "column": 5,
        "kind": "Return",
        "elems": [
        {
          "line": 7,
          "column": 15,
          "kind": "Call",
          "elems": [
          {
            "line": 7,
            "column": 12,
            "kind": "Ident",
            "elems": []
          },
          {
            "line": 7,
            "column": 16,
            "kind": "IntLiteral",
            "elems": []
          },
          {
            "line": 7,
            "column": 19,
            "kind": "IntLiteral",
            "elems": []
          }
          ]
        }
        ]
      }
      ]
    }
    ]
  }
  ]
}
