{
  "line": 1,
  "column": 1,
  "kind": "Program",
  "elems": [
  {
    "line": 1,
    "column": 1,
    "kind": "StructDecl",
    "elems": [
    {
      "line": 1,
      "column": 8,
      "kind": "Ident",
      "elems": []
    },
    {
      "line": 2,
      "column": 5,
      "kind": "Declare",
      "mut": "val",
      "type": "Int64",
      "elems": [
      {
        "line": 2,
        "column": 5,
        "kind": "Ident",
        "elems": []
      }
      ]
    },
    {
      "line": 3,
      "column": 5,
      "kind": "Declare",
      "mut": "val",
      "type": "Int64",
      "elems": [
      {
        "line": 3,
        "column": 5,
        "kind": "Ident",
        "elems": []
      }
      ]
    }
    ]
  },
  {
    "line": 6,
    "column": 1,
    "kind": "FuncDecl",
    "returnType": "Int64",
    "elems": [
    {
      "line": 6,
      "column": 5,
      "kind": "Ident",
      "elems": []
    },
    {
      "line": 6,
      "column": 19,
      "kind": "Block",
      "elems": [
      {
        "line": 7,
        "column": 5,
        "kind": "Declare",
        "mut": "var",
        "type": "Point",
        "elems": [
        {
          "line": 7,
          "column": 9,
          "kind": "Ident",
          "elems": []
        }
        ]
      },
      {
        "line": 8,
        "column": 9,
        "kind": "Assign",
        "elems": [
        {
          "line": 8,
          "column": 6,
          "kind": "FieldAccess",
          "elems": [
          {
            "line": 8,
            "column": 5,
            "kind": "Ident",
            "elems": []
          },
          {
            "line": 8,
            "column": 7,
            "kind": "Ident",
            "elems": []
          }
          ]
        },
        {
          "line": 8,
          "column": 11,
          "kind": "IntLiteral",
          "elems": []
        }
        ]
      },
      {
        "line": 9,
        "column": 9,
        "kind": "Assign",
        "elems": [
        {
          "line": 9,
          "column": 6,
          "kind": "FieldAccess",
          "elems": [
          {
            "line": 9,
            "column": 5,
            "kind": "Ident",
            "elems": []
          },
          {
            "line": 9,
            "column": 7,
            "kind": "Ident",
            "elems": []
          }
          ]
        },
        {
          "line": 9,
          "column": 11,
          "kind": "IntLiteral",
          "elems": []
        }
        ]
      },
      {
        "line": 10,
        "column": 5,
        "kind": "Declare",
        "mut": "val",
        "type": "Int64",
        "elems": [
        {
          "line": 10,
          "column": 9,
          "kind": "Ident",
          "elems": []
        },
        {
          "line": 10,
          "column": 26,
          "kind": "BinOp",
          "elems": [
          {
            "line": 10,
            "column": 23,
            "kind": "FieldAccess",
            "elems": [
            {
              "line": 10,
              "column": 22,
              "kind": "Ident",
              "elems": []
            },
            {
              "line": 10,
              "column": 24,
              "kind": "Ident",
              "elems": []
            }
            ]
          },
          {
            "line": 10,
            "column": 29,
            "kind": "FieldAccess",
            "elems": [
            {
              "line": 10,
              "column": 28,
              "kind": "Ident",
              "elems": []
            },
            {
              "line": 10,
              "column": 30,
              "kind": "Ident",
              "elems": []
            }
            ]
          }
          ]
        }
        ]
      },
      {
        "line": 11,
        "column": 5,
        "kind": "Return",
        "elems": [
        {
          "line": 11,
          "column": 12,
          "kind": "Ident",
          "elems": []
        }
        ]
      }
      ]
    }
    ]
  }
  ]
}
