{
  "line": 1,
  "column": 1,
  "kind": "Program",
  "elems": [
  {
    "line": 1,
    "column": 1,
    "kind": "Declare",
    "mut": "var",
    "elems": [
    {
      "line": 1,
      "column": 5,
      "kind": "Ident",
      "elems": []
    },
    {
      "line": 1,
      "column": 9,
      "kind": "IntLiteral",
      "elems": []
    }
    ]
  },
  {
    "line": 2,
    "column": 3,
    "kind": "Assign",
    "elems": [
    {
      "line": 2,
      "column": 1,
      "kind": "Ident",
      "elems": []
    },
    {
      "line": 2,
      "column": 5,
      "kind": "IntLiteral",
      "elems": []
    }
    ]
  },
  {
    "line": 3,
    "column": 3,
    "kind": "Assign",
    "elems": [
    {
      "line": 3,
      "column": 1,
      "kind": "Ident",
      "elems": []
    },
    {
      "line": 3,
      "column": 7,
      "kind": "BinOp",
      "elems": [
      {
        "line": 3,
        "column": 5,
        "kind": "Ident",
        "elems": []
      },
      {
        "line": 3,
        "column": 9,
        "kind": "IntLiteral",
        "elems": []
      }
      ]
    }
    ]
  },
  {
    "line": 4,
    "column": 1,
    "kind": "Return",
    "elems": [
    {
      "line": 4,
      "column": 8,
      "kind": "Ident",
      "elems": []
    }
    ]
  }
  ]
}
