{
  "kind": "Program",
  "line": 1,
  "column": 1,
  "elems": [
    {
      "kind": "Block",
      "line": 1,
      "column": 1,
      "elems": [
        {
          "kind": "Declare",
          "line": 2,
          "column": 1,
          "mut": false,
          "elems": [
            {
              "kind": "Ident",
              "name": "x",
              "elems": [],
              "line": 2,
              "column": 5
            },
            {
              "kind": "IntLiteral",
              "line": 2,
              "column": 9,
              "value": 1,
              "elems": []
            }
          ]
        },
        {
          "kind": "Assign",
          "line": 3,
          "column": 3,
          "elems": [
            {
              "kind": "Ident",
              "line": 3,
              "column": 1,
              "name": "x",
              "elems": []
            },
            {
              "kind": "BinOp",
              "line": 3,
              "column": 7,
              "op": "plus",
              "elems": [
                {
                  "kind": "Ident",
                  "line": 3,
                  "column": 5,
                  "name": "x",
                  "elems": []
                },
                {
                  "kind": "IntLiteral",
                  "line": 3,
                  "column": 9,
                  "value": 42,
                  "elems": []
                }
              ]
            }
          ]
        }
      ]
    }
  ]
}