{
  "line": 1,
  "column": 1,
  "kind": "Program",
  "elems": [
  {
    "line": 1,
    "column": 1,
    "kind": "FuncDecl",
    "returnType": "Int64",
    "elems": [
    {
      "line": 1,
      "column": 5,
      "kind": "Ident",
      "elems": []
    },
    {
      "line": 1,
      "column": 19,
      "kind": "Block",
      "elems": [
      {
        "line": 2,
        "column": 5,
        "kind": "Declare",
        "mut": "val",
        "type": "String",
        "elems": [
        {
          "line": 2,
          "column": 9,
          "kind": "Ident",
          "elems": []
        },
        {
          "line": 2,
          "column": 21,
          "kind": "StringLiteral",
          "elems": []
        }
        ]
      },
      {
        "line": 3,
        "column": 5,
        "kind": "Declare",
        "mut": "val",
        "type": "String",
        "elems": [
        {
          "line": 3,
          "column": 9,
          "kind": "Ident",
          "elems": []
        },
        {
          "line": 3,
          "column": 21,
          "kind": "StringLiteral",
          "elems": []
        }
        ]
      },
      {
        "line": 4,
        "column": 5,
        "kind": "Declare",
        "mut": "val",
        "type": "String",
        "elems": [
        {
          "line": 4,
          "column": 9,
          "kind": "Ident",
          "elems": []
        },
        {
          "line": 4,
          "column": 21,
          "kind": "StringLiteral",
          "elems": []
        }
        ]
      },
      {
        "line": 5,
        "column": 5,
        "kind": "Return",
        "elems": [
        {
          "line": 5,
          "column": 12,
          "kind": "IntLiteral",
          "elems": []
        }
        ]
      }
      ]
    }
    ]
  }
  ]
}
