{
  "kind": "Program",
  "line": 1,
  "column": 1,
  "elems": [
    {
      "kind": "Return",
      "line": 1,
      "column": 1,
      "elems": [
        {
          "kind": "BinOp",
          "line": 1,
          "column": 12,
          "op": "plus",
          "elems": [
            {
              "kind": "IntLiteral",
              "line": 1,
              "column": 9,
              "value": 42,
              "elems": []
            },
            {
              "kind": "IntLiteral",
              "line": 1,
              "column": 14,
              "value": 3,
              "elems": []
            }
          ]
        }
      ]
    }
  ]
}